{
  "$schema": "./node_modules/@neural-ng/theme/schema.json",
  "schemaVersion": 1,
  "name": "starter",
  "extends": "neutral",
  "color": {
    "primary": "blue",
    "surface": "slate",
    "success": "#16a34a",
    "warning": "#ca8a04",
    "error": "#dc2626"
  },
  "typography": {
    "sans": "Inter, ui-sans-serif, system-ui, sans-serif",
    "mono": "ui-monospace, SFMono-Regular, Menlo, Monaco, Consolas, monospace",
    "scale": "default"
  },
  "shape": {
    "radius": "large",
    "border": "default"
  },
  "density": "comfortable",
  "elevation": "soft",
  "motion": "default",
  "modes": {
    "dark": "auto"
  },
  "components": {
    "toast": {
      "messageRadius": "1rem"
    }
  },
  "output": {
    "tailwind": true,
    "tokens": true,
    "report": true,
    "types": true
  },
  "generator": {
    "colorAlgorithm": "neural-oklch-v1"
  }
}
